{
  "schema_version": 1,
  "algorithm": "double-ratchet",
  "source": "generated by tacenta-model Vectors.lean (lake exe genvectors)",
  "vectors": [
    {
      "id": "in-order-3",
      "comment": "alice sends three, bob receives in order",
      "init": { "sk": "0101010101010101010101010101010101010101010101010101010101010101", "alice_pub": "0a0a0a0a0a0a0a0a0a0a0a0a0a0a0a0a0a0a0a0a0a0a0a0a0a0a0a0a0a0a0a0a", "bob_pub": "0b0b0b0b0b0b0b0b0b0b0b0b0b0b0b0b0b0b0b0b0b0b0b0b0b0b0b0b0b0b0b0b", "dh_ab": "cfdfcbc7bddad79f64457059b7332192adfe709d296919f4b319b8665fad9056" },
      "steps": [
        { "actor": "alice", "op": "send", "mk": "80a5f4dc8f3a1105121e1526990481466cbc520101851faf15482a64830b06ec" },
        { "actor": "alice", "op": "send", "mk": "d9cc68862cdc36994a805bca77719a0b1105b1857659848d8a095190d9b6af0e" },
        { "actor": "alice", "op": "send", "mk": "c05aaeebe330f90856a08a48a300ecbcabc97de5824f6adbf4bee89ca69445f1" },
        { "actor": "bob", "op": "receive", "header": { "dh": "0a0a0a0a0a0a0a0a0a0a0a0a0a0a0a0a0a0a0a0a0a0a0a0a0a0a0a0a0a0a0a0a", "pn": 0, "n": 0 }, "dh_recv": "cfdfcbc7bddad79f64457059b7332192adfe709d296919f4b319b8665fad9056", "dh_send": "6a785b4344bf7d77f09d6731257384121cfff4d5a527eb43bcfbb8c4efeddb57", "new_pub": "2b2b2b2b2b2b2b2b2b2b2b2b2b2b2b2b2b2b2b2b2b2b2b2b2b2b2b2b2b2b2b2b", "mk": "80a5f4dc8f3a1105121e1526990481466cbc520101851faf15482a64830b06ec" },
        { "actor": "bob", "op": "receive", "header": { "dh": "0a0a0a0a0a0a0a0a0a0a0a0a0a0a0a0a0a0a0a0a0a0a0a0a0a0a0a0a0a0a0a0a", "pn": 0, "n": 1 }, "dh_recv": "0000000000000000000000000000000000000000000000000000000000000000", "dh_send": "0000000000000000000000000000000000000000000000000000000000000000", "new_pub": "0000000000000000000000000000000000000000000000000000000000000000", "mk": "d9cc68862cdc36994a805bca77719a0b1105b1857659848d8a095190d9b6af0e" },
        { "actor": "bob", "op": "receive", "header": { "dh": "0a0a0a0a0a0a0a0a0a0a0a0a0a0a0a0a0a0a0a0a0a0a0a0a0a0a0a0a0a0a0a0a", "pn": 0, "n": 2 }, "dh_recv": "0000000000000000000000000000000000000000000000000000000000000000", "dh_send": "0000000000000000000000000000000000000000000000000000000000000000", "new_pub": "0000000000000000000000000000000000000000000000000000000000000000", "mk": "c05aaeebe330f90856a08a48a300ecbcabc97de5824f6adbf4bee89ca69445f1" }
      ]
    },
    {
      "id": "out-of-order-skip",
      "comment": "alice sends three, bob receives third then first then second",
      "init": { "sk": "0101010101010101010101010101010101010101010101010101010101010101", "alice_pub": "0a0a0a0a0a0a0a0a0a0a0a0a0a0a0a0a0a0a0a0a0a0a0a0a0a0a0a0a0a0a0a0a", "bob_pub": "0b0b0b0b0b0b0b0b0b0b0b0b0b0b0b0b0b0b0b0b0b0b0b0b0b0b0b0b0b0b0b0b", "dh_ab": "cfdfcbc7bddad79f64457059b7332192adfe709d296919f4b319b8665fad9056" },
      "steps": [
        { "actor": "alice", "op": "send", "mk": "80a5f4dc8f3a1105121e1526990481466cbc520101851faf15482a64830b06ec" },
        { "actor": "alice", "op": "send", "mk": "d9cc68862cdc36994a805bca77719a0b1105b1857659848d8a095190d9b6af0e" },
        { "actor": "alice", "op": "send", "mk": "c05aaeebe330f90856a08a48a300ecbcabc97de5824f6adbf4bee89ca69445f1" },
        { "actor": "bob", "op": "receive", "header": { "dh": "0a0a0a0a0a0a0a0a0a0a0a0a0a0a0a0a0a0a0a0a0a0a0a0a0a0a0a0a0a0a0a0a", "pn": 0, "n": 2 }, "dh_recv": "cfdfcbc7bddad79f64457059b7332192adfe709d296919f4b319b8665fad9056", "dh_send": "6a785b4344bf7d77f09d6731257384121cfff4d5a527eb43bcfbb8c4efeddb57", "new_pub": "2b2b2b2b2b2b2b2b2b2b2b2b2b2b2b2b2b2b2b2b2b2b2b2b2b2b2b2b2b2b2b2b", "mk": "c05aaeebe330f90856a08a48a300ecbcabc97de5824f6adbf4bee89ca69445f1" },
        { "actor": "bob", "op": "receive", "header": { "dh": "0a0a0a0a0a0a0a0a0a0a0a0a0a0a0a0a0a0a0a0a0a0a0a0a0a0a0a0a0a0a0a0a", "pn": 0, "n": 0 }, "dh_recv": "0000000000000000000000000000000000000000000000000000000000000000", "dh_send": "0000000000000000000000000000000000000000000000000000000000000000", "new_pub": "0000000000000000000000000000000000000000000000000000000000000000", "mk": "80a5f4dc8f3a1105121e1526990481466cbc520101851faf15482a64830b06ec" },
        { "actor": "bob", "op": "receive", "header": { "dh": "0a0a0a0a0a0a0a0a0a0a0a0a0a0a0a0a0a0a0a0a0a0a0a0a0a0a0a0a0a0a0a0a", "pn": 0, "n": 1 }, "dh_recv": "0000000000000000000000000000000000000000000000000000000000000000", "dh_send": "0000000000000000000000000000000000000000000000000000000000000000", "new_pub": "0000000000000000000000000000000000000000000000000000000000000000", "mk": "d9cc68862cdc36994a805bca77719a0b1105b1857659848d8a095190d9b6af0e" }
      ]
    },
    {
      "id": "bidirectional",
      "comment": "alice and bob take turns, each ratcheting on the other's new key",
      "init": { "sk": "0101010101010101010101010101010101010101010101010101010101010101", "alice_pub": "0a0a0a0a0a0a0a0a0a0a0a0a0a0a0a0a0a0a0a0a0a0a0a0a0a0a0a0a0a0a0a0a", "bob_pub": "0b0b0b0b0b0b0b0b0b0b0b0b0b0b0b0b0b0b0b0b0b0b0b0b0b0b0b0b0b0b0b0b", "dh_ab": "cfdfcbc7bddad79f64457059b7332192adfe709d296919f4b319b8665fad9056" },
      "steps": [
        { "actor": "alice", "op": "send", "mk": "80a5f4dc8f3a1105121e1526990481466cbc520101851faf15482a64830b06ec" },
        { "actor": "bob", "op": "receive", "header": { "dh": "0a0a0a0a0a0a0a0a0a0a0a0a0a0a0a0a0a0a0a0a0a0a0a0a0a0a0a0a0a0a0a0a", "pn": 0, "n": 0 }, "dh_recv": "cfdfcbc7bddad79f64457059b7332192adfe709d296919f4b319b8665fad9056", "dh_send": "6a785b4344bf7d77f09d6731257384121cfff4d5a527eb43bcfbb8c4efeddb57", "new_pub": "2b2b2b2b2b2b2b2b2b2b2b2b2b2b2b2b2b2b2b2b2b2b2b2b2b2b2b2b2b2b2b2b", "mk": "80a5f4dc8f3a1105121e1526990481466cbc520101851faf15482a64830b06ec" },
        { "actor": "bob", "op": "send", "mk": "26f62ddf0cfcb3d68dea3acd4b0bc66f1278b02866a0d478fc871245751ab03f" },
        { "actor": "alice", "op": "receive", "header": { "dh": "2b2b2b2b2b2b2b2b2b2b2b2b2b2b2b2b2b2b2b2b2b2b2b2b2b2b2b2b2b2b2b2b", "pn": 0, "n": 0 }, "dh_recv": "6a785b4344bf7d77f09d6731257384121cfff4d5a527eb43bcfbb8c4efeddb57", "dh_send": "969a361c6393179db8f08da295ebd36ad7902f97af472cfe306b1bb0a83f758e", "new_pub": "1a1a1a1a1a1a1a1a1a1a1a1a1a1a1a1a1a1a1a1a1a1a1a1a1a1a1a1a1a1a1a1a", "mk": "26f62ddf0cfcb3d68dea3acd4b0bc66f1278b02866a0d478fc871245751ab03f" },
        { "actor": "alice", "op": "send", "mk": "a07d47a03c9c0b552405f9c916113eb8c4d67dbd3e0f0fd686c2c2dbaf6aeb44" },
        { "actor": "bob", "op": "receive", "header": { "dh": "1a1a1a1a1a1a1a1a1a1a1a1a1a1a1a1a1a1a1a1a1a1a1a1a1a1a1a1a1a1a1a1a", "pn": 1, "n": 0 }, "dh_recv": "969a361c6393179db8f08da295ebd36ad7902f97af472cfe306b1bb0a83f758e", "dh_send": "2bf784836e1431a1785c7f3b420c1b218576126af1b6a4a224c6c1630d7a969f", "new_pub": "3b3b3b3b3b3b3b3b3b3b3b3b3b3b3b3b3b3b3b3b3b3b3b3b3b3b3b3b3b3b3b3b", "mk": "a07d47a03c9c0b552405f9c916113eb8c4d67dbd3e0f0fd686c2c2dbaf6aeb44" }
      ]
    },
    {
      "id": "peer-revisits-ratchet-key",
      "comment": "bob's peer returns to a ratchet key it had left, numbering a fresh chain from zero under a key already in the store",
      "init": { "sk": "0101010101010101010101010101010101010101010101010101010101010101", "alice_pub": "0a0a0a0a0a0a0a0a0a0a0a0a0a0a0a0a0a0a0a0a0a0a0a0a0a0a0a0a0a0a0a0a", "bob_pub": "0b0b0b0b0b0b0b0b0b0b0b0b0b0b0b0b0b0b0b0b0b0b0b0b0b0b0b0b0b0b0b0b", "dh_ab": "cfdfcbc7bddad79f64457059b7332192adfe709d296919f4b319b8665fad9056" },
      "steps": [
        { "actor": "bob", "op": "receive", "header": { "dh": "0a0a0a0a0a0a0a0a0a0a0a0a0a0a0a0a0a0a0a0a0a0a0a0a0a0a0a0a0a0a0a0a", "pn": 0, "n": 2 }, "dh_recv": "cfdfcbc7bddad79f64457059b7332192adfe709d296919f4b319b8665fad9056", "dh_send": "6a785b4344bf7d77f09d6731257384121cfff4d5a527eb43bcfbb8c4efeddb57", "new_pub": "2b2b2b2b2b2b2b2b2b2b2b2b2b2b2b2b2b2b2b2b2b2b2b2b2b2b2b2b2b2b2b2b", "mk": "c05aaeebe330f90856a08a48a300ecbcabc97de5824f6adbf4bee89ca69445f1" },
        { "actor": "bob", "op": "receive", "header": { "dh": "1a1a1a1a1a1a1a1a1a1a1a1a1a1a1a1a1a1a1a1a1a1a1a1a1a1a1a1a1a1a1a1a", "pn": 5, "n": 0 }, "dh_recv": "969a361c6393179db8f08da295ebd36ad7902f97af472cfe306b1bb0a83f758e", "dh_send": "2bf784836e1431a1785c7f3b420c1b218576126af1b6a4a224c6c1630d7a969f", "new_pub": "3b3b3b3b3b3b3b3b3b3b3b3b3b3b3b3b3b3b3b3b3b3b3b3b3b3b3b3b3b3b3b3b", "mk": "a07d47a03c9c0b552405f9c916113eb8c4d67dbd3e0f0fd686c2c2dbaf6aeb44" },
        { "actor": "bob", "op": "receive", "header": { "dh": "0a0a0a0a0a0a0a0a0a0a0a0a0a0a0a0a0a0a0a0a0a0a0a0a0a0a0a0a0a0a0a0a", "pn": 0, "n": 2 }, "dh_recv": "62040742b64d996f0999fe2d8d12576516491fd7577467f4aa8bc5f971da6393", "dh_send": "ca57189cbc39f88ddba76134033375f541ce3b4e6a22c4cba9ad781ff12bd39d", "new_pub": "4b4b4b4b4b4b4b4b4b4b4b4b4b4b4b4b4b4b4b4b4b4b4b4b4b4b4b4b4b4b4b4b", "mk": "2fa3bfc7f659f58261e193e01192b776dec8a7d46cdc545ac1b1e9db4a3892aa" }
      ]
    }
  ]
}
